{
  "$schema": "../schemas/citychat-asset-library.schema.v0.8.0.json",
  "schemaVersion": "1.0",
  "libraryVersion": "citychat-asset-library-v0.8.0",
  "artifactVersion": "0.8.0",
  "artifactBuildId": "citychat-ui-20260828-01",
  "status": "safe_public_download_catalog",
  "canonicalUrl": "https://montri-th.github.io/CityChat/",
  "scope": "Exact safe-to-download CityChat identity, icon, type, implementation, colour, motion and guidance files shipped by the DS Add-on Playground v0.8.0. Download permission does not transfer a file into an unapproved runtime role. The companion asset-only checksum covers the safe catalog paths and deliberately excludes itself to avoid a circular checksum.",
  "authorityRefs": [
    "assets/downloads/citychat-ds-addon-v0.8.md",
    "assets/identity/identity-assets.v0.8.0.json",
    "vendor/landometer/v0.9.0/package.json"
  ],
  "privacyBoundary": {
    "included": "Only exact project assets with a recorded source and public-download boundary, licensed open-source foundations, and artifact-owned implementation files are listed.",
    "excluded": [
      "personal_photos",
      "avatars",
      "screenshots",
      "user_generated_content",
      "real_location_media",
      "uncleared_working_documents",
      "unclear_rights_assets"
    ]
  },
  "assets": [
    {
      "assetId": "citychat-horizontal-lockup-png-94055c9b",
      "category": "identity",
      "displayName": {
        "th": "โลโก้ CityChat แนวนอน PNG",
        "en": "CityChat horizontal lockup PNG"
      },
      "path": "assets/identity/citychat-horizontal-lockup.png",
      "mimeType": "image/png",
      "bytes": 8371,
      "sha256": "94055c9b084eebaa585b3d31bef750abe87a1162fc1ec3be077f7fbcb2465e62",
      "source": {
        "class": "user_supplied_project_asset",
        "ref": "project source supplied before 2026-08-22"
      },
      "licence": {
        "spdxId": null,
        "noticePath": null,
        "rightsRef": "assets/identity/identity-assets.v0.8.0.json"
      },
      "publicDownload": true,
      "usePolicy": {
        "status": "role_bound",
        "allowedUses": [
          "Exact unchanged header and footer lockup in the approved v0.8.0 playground role",
          "Reference download"
        ],
        "blockedUses": [
          "Redraw, crop, recolour, filter, mask or animation",
          "Favicon, compact mark, control icon, motif or unapproved artifact role"
        ]
      }
    },
    {
      "assetId": "citychat-lockup-svg-source-3a3cd1b4",
      "category": "identity",
      "displayName": {
        "th": "ไฟล์ต้นฉบับ CityChat lockup SVG",
        "en": "CityChat lockup SVG source"
      },
      "path": "assets/identity/citychat-lockup.source.svg",
      "mimeType": "image/svg+xml",
      "bytes": 18376,
      "sha256": "3a3cd1b4c6091a107bd41502e6df04ddfc62c3074b75b850bfabdf9ddacab98c",
      "source": {
        "class": "approved_project_source",
        "ref": "project source supplied before 2026-08-22"
      },
      "licence": {
        "spdxId": null,
        "noticePath": null,
        "rightsRef": "legacy-public-download-boundary"
      },
      "publicDownload": true,
      "usePolicy": {
        "status": "source_only",
        "allowedUses": [
          "Source download and provenance inspection"
        ],
        "blockedUses": [
          "Runtime rendering or transfer into another identity role",
          "Favicon, compact mark, icon, motif, social preview or app icon"
        ]
      }
    },
    {
      "assetId": "citychat-symbol-svg-source-4d8dfd72",
      "category": "identity",
      "displayName": {
        "th": "ไฟล์ต้นฉบับ CityChat symbol SVG",
        "en": "CityChat symbol SVG source"
      },
      "path": "assets/identity/citychat-symbol.source.svg",
      "mimeType": "image/svg+xml",
      "bytes": 3714,
      "sha256": "4d8dfd72be8a666a80040291b8b75411854b9a0c90d6693111f79c721bbf1e74",
      "source": {
        "class": "approved_project_source",
        "ref": "project source supplied before 2026-08-22"
      },
      "licence": {
        "spdxId": null,
        "noticePath": null,
        "rightsRef": "legacy-public-download-boundary"
      },
      "publicDownload": true,
      "usePolicy": {
        "status": "source_only",
        "allowedUses": [
          "Source download and provenance inspection"
        ],
        "blockedUses": [
          "Runtime rendering or transfer into another identity role",
          "Favicon, compact mark, icon, motif, social preview or app icon"
        ]
      }
    },
    {
      "assetId": "citychat-identity-manifest-v0.8.0",
      "category": "guidance",
      "displayName": {
        "th": "รายการสิทธิ์และบทบาทโลโก้",
        "en": "Identity role and permission manifest"
      },
      "path": "assets/identity/identity-assets.v0.8.0.json",
      "mimeType": "application/json",
      "bytes": 6998,
      "sha256": "484e4441d92328e7ce76b2b9b1b73299566f7b92c96638aec87b80a8a42df56b",
      "source": {
        "class": "artifact_authored",
        "ref": "CityChat DS Add-on Playground v0.8.0 identity governance"
      },
      "licence": {
        "spdxId": null,
        "noticePath": null,
        "rightsRef": "artifact governance record"
      },
      "publicDownload": true,
      "usePolicy": {
        "status": "evidence_record",
        "allowedUses": [
          "Inspect exact asset hashes, approved roles and blocked roles"
        ],
        "blockedUses": [
          "Treating the manifest as approval for another build, URL or role"
        ]
      }
    },
    {
      "assetId": "material-symbols-rounded-citychat-v368",
      "category": "functional_icon",
      "displayName": {
        "th": "ชุดไอคอน CityChat 9 แบบ",
        "en": "CityChat nine-icon subset"
      },
      "path": "assets/icons/material-symbols-rounded-citychat-v368.ttf",
      "mimeType": "font/ttf",
      "bytes": 5248,
      "sha256": "42cd00d98dd631ddf6b3d5a47ba34e6eed83d2a6e3fd35ef5f4f8e0e6632ba30",
      "source": {
        "class": "pinned_upstream_open_source",
        "ref": "Google Material Symbols Rounded CSS API v368; exact subset recorded in font-assets.manifest.json"
      },
      "licence": {
        "spdxId": "Apache-2.0",
        "noticePath": "assets/icons/LICENSE.material-symbols.txt",
        "rightsRef": "Google LLC"
      },
      "publicDownload": true,
      "usePolicy": {
        "status": "library_only",
        "allowedUses": [
          "Use glyphs and axes recorded in the v0.8.0 icon map",
          "Self-host with the Apache-2.0 notice"
        ],
        "blockedUses": [
          "Guessing unregistered glyph synonyms",
          "Using a library-only icon as proof that a product capability exists"
        ]
      }
    },
    {
      "assetId": "material-symbols-apache-notice",
      "category": "licence_notice",
      "displayName": {
        "th": "ใบอนุญาต Material Symbols",
        "en": "Material Symbols licence notice"
      },
      "path": "assets/icons/LICENSE.material-symbols.txt",
      "mimeType": "text/plain",
      "bytes": 861,
      "sha256": "a5821986e6962ad8b3bb1c6ea99423ca66dc899058b6775e8569488a6d0ea518",
      "source": {
        "class": "pinned_upstream_open_source",
        "ref": "Google Material Symbols"
      },
      "licence": {
        "spdxId": "Apache-2.0",
        "noticePath": "assets/icons/LICENSE.material-symbols.txt",
        "rightsRef": "Google LLC"
      },
      "publicDownload": true,
      "usePolicy": {
        "status": "evidence_record",
        "allowedUses": [
          "Redistribute with the related icon font",
          "Licence inspection"
        ],
        "blockedUses": [
          "Removing the notice when its licence terms require retention"
        ]
      }
    },
    {
      "assetId": "citychat-icon-map-v0.8.0",
      "category": "functional_icon",
      "displayName": {
        "th": "แผนที่บทบาทไอคอน",
        "en": "Functional icon role map"
      },
      "path": "resources/citychat-ds-addon/v0.8.0/citychat-icon-map.json",
      "mimeType": "application/json",
      "bytes": 6584,
      "sha256": "6a351c71ce7f1515e55113671abab6c98e136a9e7ae8dd71d979201242b35e2c",
      "source": {
        "class": "artifact_authored",
        "ref": "CityChat DS Add-on v0.8 functional icon contract"
      },
      "licence": {
        "spdxId": null,
        "noticePath": null,
        "rightsRef": "assets/downloads/citychat-ds-addon-v0.8.md"
      },
      "publicDownload": true,
      "usePolicy": {
        "status": "library_only",
        "allowedUses": [
          "Resolve a named CityChat function to a registered glyph and accessible label"
        ],
        "blockedUses": [
          "Enabling reply, share, history, receipt or officer capability without its owning product evidence"
        ]
      }
    },
    {
      "assetId": "citychat-icon-resolution-v0.8.0",
      "category": "functional_icon",
      "displayName": {
        "th": "รายการจุดใช้ไอคอนจริง",
        "en": "Resolved icon bindings"
      },
      "path": "resources/citychat-ds-addon/v0.8.0/citychat-icon-resolution.json",
      "mimeType": "application/json",
      "bytes": 9460,
      "sha256": "e5be36e1613e469d76e4d04ffdc4e6f30115a31b9483b7c6c2b5c46998958b35",
      "source": {
        "class": "artifact_generated",
        "ref": "CityChat DS Add-on Playground v0.8.0 control inventory"
      },
      "licence": {
        "spdxId": null,
        "noticePath": null,
        "rightsRef": "artifact governance record"
      },
      "publicDownload": true,
      "usePolicy": {
        "status": "evidence_record",
        "allowedUses": [
          "Inspect permitted and blocked icon bindings in this artifact"
        ],
        "blockedUses": [
          "Transferring an artifact binding into product runtime without the named capability evidence"
        ]
      }
    },
    {
      "assetId": "citychat-icon-font-manifest-v0.8.0",
      "category": "functional_icon",